<?xml version="1.0" encoding="UTF-8" standalone="yes"?>
<projeto xmlns="http://www.nasajon.com.br/nsjbuild" xmlns:xsi="http://www.w3.org/2001/XMLSchema-instance" xsi:schemaLocation="http://www.nasajon.com.br/nsjbuild nsjBuildProject.xsd ">
    <nome>dashboardclientes</nome>
    <autor>[Identidde Nasajon]</autor>
    <dataCriacao>[01/01/1900]</dataCriacao>
    <resumo>[Indicar resumo para documentação do projeto]</resumo>
    <path>source\desktop_new\commonfeature\dashboardclientes\package\dashboardclientes.dproj</path>
    <dependencias>
        <dependencia>followup</dependencia>
        <dependencia>nstraducao</dependencia>
        <dependencia>commonutils_static</dependencia>
        <dependencia>nsdashboard</dependencia>
        <dependencia>objetosservicos</dependencia>
        <dependencia>financeiro</dependencia>
        <dependencia>proposta</dependencia>
        <dependencia>ordensdeservicobase</dependencia>
        <dependencia>objetosservicosbase</dependencia>
        <dependencia>propostabase</dependencia>
        <dependencia>entidadesempresariais</dependencia>
    </dependencias>
</projeto>
