<?xml version="1.0" encoding="UTF-8" standalone="yes"?>
<projeto xmlns="http://www.nasajon.com.br/nsjbuild" xmlns:xsi="http://www.w3.org/2001/XMLSchema-instance" xsi:schemaLocation="http://www.nasajon.com.br/nsjbuild nsjBuildProject.xsd ">
    <nome>MOVIMENTO</nome>
    <path>source\desktop_new\commonfeature\movimento\package\movimento.dproj</path>
    <dependencias>
        <dependencia>COMMONUTILS_STATIC</dependencia>
        <dependencia>ITEM</dependencia>
        <dependencia>PRODUTO</dependencia>
        <dependencia>NSORM</dependencia>
        <dependencia>DOCFIS</dependencia>
        <dependencia>SCRITTAMATERIAIS</dependencia>
        <dependencia>CONFIGURACAO</dependencia>
        <dependencia>OPERACOES</dependencia>
        <dependencia>ENTIDADESEMPRESARIAIS</dependencia>
    </dependencias>
</projeto>
