<?xml version="1.0" encoding="UTF-8" standalone="yes"?>
<projeto xmlns="http://www.nasajon.com.br/nsjbuild" xmlns:xsi="http://www.w3.org/2001/XMLSchema-instance" xsi:schemaLocation="http://www.nasajon.com.br/nsjbuild nsjBuildProject.xsd ">
    <nome>PRODUCAO</nome>
    <path>source\desktop_new\commonfeature\producao\package\producao.dproj</path>
    <dependencias>
        <dependencia>ETIQUETA</dependencia>
        <dependencia>COMMONUTILS_STATIC</dependencia>
        <dependencia>PRODUTO</dependencia>
        <dependencia>NSJREPORTEDITOR</dependencia>
        <dependencia>NSORM</dependencia>
        <dependencia>SCRITTAMATERIAIS</dependencia>
        <dependencia>RESOURCES</dependencia>
        <dependencia>ETIQUETA_BASE</dependencia>
        <dependencia>RELATORIOS</dependencia>
        <dependencia>CONFIGURACAO</dependencia>
        <dependencia>OPERACOES</dependencia>
        <dependencia>ENTIDADESEMPRESARIAIS</dependencia>
    </dependencias>
</projeto>
