<?xml version="1.0" encoding="UTF-8" standalone="yes"?>
<projeto xmlns="http://www.nasajon.com.br/nsjbuild" xmlns:xsi="http://www.w3.org/2001/XMLSchema-instance" xsi:schemaLocation="http://www.nasajon.com.br/nsjbuild nsjBuildProject.xsd ">
    <nome>controlesaldosprodutos</nome>
    <autor>[Identidde Nasajon]</autor>
    <dataCriacao>[01/01/1900]</dataCriacao>
    <resumo>[Indicar resumo para documentação do projeto]</resumo>
    <path>source\desktop_new\commonfeature\controlesaldosprodutos\package\controlesaldosprodutos.dproj</path>
    <dependencias>
        <dependencia>commonutils_static</dependencia>
        <dependencia>documentositens</dependencia>
        <dependencia>nsorm</dependencia>
        <dependencia>nsjusuarios</dependencia>
        <dependencia>resources</dependencia>
        <dependencia>categoriadeproduto</dependencia>
        <dependencia>configuracao</dependencia>
        <dependencia>entidadesempresariais</dependencia>
    </dependencias>
</projeto>
