<?xml version="1.0" encoding="UTF-8" standalone="yes"?>
<projeto xmlns="http://www.nasajon.com.br/nsjbuild" xmlns:xsi="http://www.w3.org/2001/XMLSchema-instance" xsi:schemaLocation="http://www.nasajon.com.br/nsjbuild nsjBuildProject.xsd ">
    <nome>propostabase</nome>
    <autor>[Identidde Nasajon]</autor>
    <dataCriacao>[01/01/1900]</dataCriacao>
    <resumo>[Indicar resumo para documentação do projeto]</resumo>
    <path>source\desktop_new\commonfeature\propostabase\package\propostabase.dproj</path>
    <dependencias>
        <dependencia>commonutils_static</dependencia>
        <dependencia>itensfaturamentobase</dependencia>
        <dependencia>financeiro</dependencia>
        <dependencia>nsorm</dependencia>
        <dependencia>nsintegradorged</dependencia>
        <dependencia>naturezascontratos</dependencia>
        <dependencia>followup</dependencia>
        <dependencia>nstraducao</dependencia>
        <dependencia>componentesbase</dependencia>
        <dependencia>rps</dependencia>
        <dependencia>documentositens</dependencia>
        <dependencia>nsjusuarios</dependencia>
        <dependencia>propostaoperacao</dependencia>
        <dependencia>ofertasbase</dependencia>
        <dependencia>formapagamento</dependencia>
        <dependencia>entidadesempresariais</dependencia>
    </dependencias>
</projeto>
