<?xml version="1.0" encoding="UTF-8" standalone="yes"?>
<projeto xmlns="http://www.nasajon.com.br/nsjbuild" xmlns:xsi="http://www.w3.org/2001/XMLSchema-instance" xsi:schemaLocation="http://www.nasajon.com.br/nsjbuild nsjBuildProject.xsd ">
    <nome>DASHBOARDCLIENTES</nome>
    <path>source\desktop_new\commonfeature\dashboardclientes\package\dashboardclientes.dproj</path>
    <dependencias>
        <dependencia>FOLLOWUP</dependencia>
        <dependencia>NSTRADUCAO</dependencia>
        <dependencia>COMMONUTILS_STATIC</dependencia>
        <dependencia>NSDASHBOARD</dependencia>
        <dependencia>OBJETOSSERVICOS</dependencia>
        <dependencia>FINANCEIRO</dependencia>
        <dependencia>PROPOSTA</dependencia>
        <dependencia>ORDENSDESERVICOBASE</dependencia>
        <dependencia>OBJETOSSERVICOSBASE</dependencia>
        <dependencia>PROPOSTABASE</dependencia>
        <dependencia>ENTIDADESEMPRESARIAIS</dependencia>
    </dependencias>
</projeto>
