<?xml version="1.0" encoding="UTF-8" standalone="yes"?>
<projeto xmlns="http://www.nasajon.com.br/nsjbuild" xmlns:xsi="http://www.w3.org/2001/XMLSchema-instance" xsi:schemaLocation="http://www.nasajon.com.br/nsjbuild nsjBuildProject.xsd ">
    <nome>servicostecnicos</nome>
    <path>source\desktop_new\commonfeature\servicostecnicos\package\servicosTecnicos.dproj</path>
    <dependencias>
        <dependencia>commonutils_static</dependencia>
        <dependencia>itensfaturamento</dependencia>
        <dependencia>itensfaturamentobase</dependencia>
        <dependencia>nsorm</dependencia>
        <dependencia>classificacaofinanceira</dependencia>
        <dependencia>tiposdeservicos</dependencia>
        <dependencia>entidadesempresariais</dependencia>
    </dependencias>
    <ultimaCompilacao>2016-08-20T09:42:21.654-03:00</ultimaCompilacao>
</projeto>
