<?xml version="1.0" encoding="UTF-8" standalone="yes"?>
<projeto xmlns="http://www.nasajon.com.br/nsjbuild" xmlns:xsi="http://www.w3.org/2001/XMLSchema-instance" xsi:schemaLocation="http://www.nasajon.com.br/nsjbuild nsjBuildProject.xsd ">
    <nome>ATENDIMENTO</nome>
    <path>source\desktop_new\commonfeature\atendimentos\package\atendimento.dproj</path>
    <dependencias>
        <dependencia>COMMONUTILS_STATIC</dependencia>
        <dependencia>NSJREPORTEDITOR</dependencia>
        <dependencia>OBJETOSSERVICOS</dependencia>
        <dependencia>SERVICOSTECNICOS</dependencia>
        <dependencia>NSORM</dependencia>
        <dependencia>NSREPORT</dependencia>
        <dependencia>OBJETOSSERVICOSBASE</dependencia>
        <dependencia>OPERACAOORDEMSERVICO</dependencia>
        <dependencia>TIPOSFOLLOWUPS</dependencia>
        <dependencia>RELATORIOS</dependencia>
        <dependencia>FOLLOWUP</dependencia>
        <dependencia>NSTRADUCAO</dependencia>
        <dependencia>TIPOSORDENSSERVICOS</dependencia>
        <dependencia>PRODUTO</dependencia>
        <dependencia>NSJUSUARIOS</dependencia>
        <dependencia>TIPOSMANUTENCOES</dependencia>
        <dependencia>PRIORIDADESATENDIMENTOS</dependencia>
        <dependencia>REQUISICAOALMOXARIFADO</dependencia>
        <dependencia>USUARIO</dependencia>
        <dependencia>RESOURCES</dependencia>
        <dependencia>CONFIGURACAO</dependencia>
        <dependencia>OPERACOES</dependencia>
        <dependencia>ENTIDADESEMPRESARIAIS</dependencia>
    </dependencias>
</projeto>
