<?xml version="1.0" encoding="UTF-8" standalone="yes"?>
<projeto xmlns="http://www.nasajon.com.br/nsjbuild" xmlns:xsi="http://www.w3.org/2001/XMLSchema-instance" xsi:schemaLocation="http://www.nasajon.com.br/nsjbuild nsjBuildProject.xsd ">
    <nome>banco</nome>
    <path>source\desktop_new\commonfeature\banco\package\banco.dproj</path>
    <dependencias>
        <dependencia>commonutils_static</dependencia>
        <dependencia>nsorm</dependencia>
        <dependencia>nsjapi</dependencia>
    </dependencias>
    <ultimaCompilacao>2016-08-20T09:39:07.431-03:00</ultimaCompilacao>
</projeto>
