<?xml version="1.0" encoding="UTF-8" standalone="yes"?>
<projeto xmlns="http://www.nasajon.com.br/nsjbuild" xmlns:xsi="http://www.w3.org/2001/XMLSchema-instance" xsi:schemaLocation="http://www.nasajon.com.br/nsjbuild nsjBuildProject.xsd ">
    <nome>nsjestoque</nome>
    <autor>[Identidde Nasajon]</autor>
    <dataCriacao>[01/01/1900]</dataCriacao>
    <resumo>[Indicar resumo para documentação do projeto]</resumo>
    <path>source\desktop_new\projects\estoque\projeto\nsjEstoque.dproj</path>
    <dependencias>
        <dependencia>limitedecredito</dependencia>
        <dependencia>arquivolayout</dependencia>
        <dependencia>nsjreporteditor</dependencia>
        <dependencia>consultadocengine</dependencia>
        <dependencia>nsreport</dependencia>
        <dependencia>objetosservicosbase</dependencia>
        <dependencia>nslicenciamento</dependencia>
        <dependencia>relatorios</dependencia>
        <dependencia>centrodecustofinanceiro</dependencia>
        <dependencia>geradordedocumento</dependencia>
        <dependencia>rateiopadrao</dependencia>
        <dependencia>figuratributaria</dependencia>
        <dependencia>nsjusuarios</dependencia>
        <dependencia>inventario</dependencia>
        <dependencia>item</dependencia>
        <dependencia>perfilimportacao</dependencia>
        <dependencia>workflow</dependencia>
        <dependencia>nsorm</dependencia>
        <dependencia>cfop</dependencia>
        <dependencia>nsjapi</dependencia>
        <dependencia>nstraducao</dependencia>
        <dependencia>nsprotecao</dependencia>
        <dependencia>pesssoaclassificacao</dependencia>
        <dependencia>workflowcommonfeature</dependencia>
        <dependencia>unidades</dependencia>
        <dependencia>grade</dependencia>
        <dependencia>docfis</dependencia>
        <dependencia>producao</dependencia>
        <dependencia>usuario</dependencia>
        <dependencia>resources</dependencia>
        <dependencia>controlesaldosprodutos</dependencia>
        <dependencia>formapagamento</dependencia>
        <dependencia>entidadesempresariais</dependencia>
        <dependencia>ciclofaturamento</dependencia>
        <dependencia>bi</dependencia>
        <dependencia>projetos</dependencia>
        <dependencia>nscertificadodigital</dependencia>
        <dependencia>numeroserie</dependencia>
        <dependencia>contafinanceira</dependencia>
        <dependencia>nsintegradorged</dependencia>
        <dependencia>etiqueta</dependencia>
        <dependencia>nsxeutil</dependencia>
        <dependencia>ncm</dependencia>
        <dependencia>requisicaoalmoxarifado</dependencia>
        <dependencia>rateios</dependencia>
        <dependencia>etiqueta_base</dependencia>
        <dependencia>categoriadeproduto</dependencia>
        <dependencia>configuracao</dependencia>
        <dependencia>movimento</dependencia>
        <dependencia>cfopexclusao_fatura</dependencia>
        <dependencia>participantes</dependencia>
        <dependencia>veiculo</dependencia>
        <dependencia>commonutils_static</dependencia>
        <dependencia>objetosservicos</dependencia>
        <dependencia>itemestabelecimento</dependencia>
        <dependencia>financeiro</dependencia>
        <dependencia>cest</dependencia>
        <dependencia>nsproxy</dependencia>
        <dependencia>moeda</dependencia>
        <dependencia>produto</dependencia>
        <dependencia>pretitulos</dependencia>
        <dependencia>docengine</dependencia>
        <dependencia>scrittamateriais</dependencia>
        <dependencia>nslog</dependencia>
        <dependencia>nsemail</dependencia>
        <dependencia>operacoes</dependencia>
    </dependencias>
</projeto>
