<?xml version="1.0" encoding="UTF-8" standalone="yes"?>
<projeto xmlns="http://www.nasajon.com.br/nsjbuild" xmlns:xsi="http://www.w3.org/2001/XMLSchema-instance" xsi:schemaLocation="http://www.nasajon.com.br/nsjbuild nsjBuildProject.xsd ">
    <nome>NSJCONVERSOR</nome>
    <path>source\desktop_new\projects\conversor\nsjConversor.dproj</path>
    <dependencias>
        <dependencia>COMMONUTILS_STATIC</dependencia>
        <dependencia>NSPROTECAO</dependencia>
        <dependencia>NSJPERSONA</dependencia>
        <dependencia>NSXEUTIL</dependencia>
        <dependencia>NSJCONTABIL</dependencia>
        <dependencia>NSLOG</dependencia>
        <dependencia>NSJAPI</dependencia>
    </dependencias>
</projeto>
