<?xml version="1.0" encoding="UTF-8" standalone="yes"?>
<projeto xmlns="http://www.nasajon.com.br/nsjbuild" xmlns:xsi="http://www.w3.org/2001/XMLSchema-instance" xsi:schemaLocation="http://www.nasajon.com.br/nsjbuild nsjBuildProject.xsd ">
    <nome>clientes</nome>
    <path>source\desktop_new\commonfeature\clientes\package\clientes.dproj</path>
    <dependencias>
        <dependencia>rpsbase</dependencia>
        <dependencia>commonutils_static</dependencia>
        <dependencia>rps</dependencia>
        <dependencia>proposta</dependencia>
        <dependencia>financeiro</dependencia>
        <dependencia>dashboardclientes</dependencia>
        <dependencia>propostabase</dependencia>
        <dependencia>resources</dependencia>
        <dependencia>entidadesempresariais</dependencia>
    </dependencias>
</projeto>
