<?xml version="1.0" encoding="UTF-8" standalone="yes"?>
<projeto xmlns="http://www.nasajon.com.br/nsjbuild" xmlns:xsi="http://www.w3.org/2001/XMLSchema-instance" xsi:schemaLocation="http://www.nasajon.com.br/nsjbuild nsjBuildProject.xsd ">
    <nome>NCM</nome>
    <path>source\desktop_new\commonfeature\ncm\package\ncm.dproj</path>
    <dependencias>
        <dependencia>COMMONUTILS_STATIC</dependencia>
        <dependencia>PERFILIMPORTACAO</dependencia>
        <dependencia>NSORM</dependencia>
        <dependencia>USUARIO</dependencia>
    </dependencias>
</projeto>
