<?xml version="1.0" encoding="UTF-8" standalone="yes"?>
<projeto xmlns="http://www.nasajon.com.br/nsjbuild" xmlns:xsi="http://www.w3.org/2001/XMLSchema-instance" xsi:schemaLocation="http://www.nasajon.com.br/nsjbuild nsjBuildProject.xsd ">
    <nome>objetosservicosbase</nome>
    <path>source\desktop_new\commonfeature\objetosservicosbase\package\objetosservicosbase.dproj</path>
    <dependencias>
        <dependencia>nstraducao</dependencia>
        <dependencia>commonutils_static</dependencia>
        <dependencia>nsorm</dependencia>
        <dependencia>elementosdecontrolebase</dependencia>
        <dependencia>configuracao</dependencia>
    </dependencias>
</projeto>
