<?xml version="1.0" encoding="UTF-8" standalone="yes"?>
<projeto xmlns="http://www.nasajon.com.br/nsjbuild" xmlns:xsi="http://www.w3.org/2001/XMLSchema-instance" xsi:schemaLocation="http://www.nasajon.com.br/nsjbuild nsjBuildProject.xsd ">
    <nome>nsjconversor</nome>
    <path>source\desktop_new\projects\conversor\nsjConversor.dproj</path>
    <dependencias>
        <dependencia>commonutils_static</dependencia>
        <dependencia>nsprotecao</dependencia>
        <dependencia>nsjpersona</dependencia>
        <dependencia>nsxeutil</dependencia>
        <dependencia>usuario</dependencia>
        <dependencia>nsjcontabil</dependencia>
        <dependencia>nslog</dependencia>
        <dependencia>nsjapi</dependencia>
    </dependencias>
</projeto>
